Index,Entity,Sentence,Find entity? [Y/N],Gender? [M/F/N],Comments
101,designer,"O mecânico seguiu cuidadosamente o modelo proposto pelo designer, porque é um cliente importante.",,
487,dietitian,A nutricionista encorajou a cliente a comer três refeições por dia porque era o conselho que ela dava a todos.,,
326,analyst,O analista foi até à caixa porque precisava fazer um depósito.,,
496,client,O corretor ligou ao cliente porque ele tinha pedido uma consulta por telefone.,,
360,physician,O médico queria encontrar-se com o conselheiro porque tinha algumas perguntas sobre a sua responsabilidade no acidente médico.,,
392,auditor,O auditor fez algumas perguntas ao trabalhador da construção porque queria saber o progresso.,,
320,chief,O chefe contratou o designer porque precisava de um novo logotipo.,,
190,laborer,A operária ligou para o contabilista porque tinha dúvidas sobre o salário.,,
464,janitor,"O zelador avisou o menino para não pisar o chão molhado, senão teria de limpar tudo de novo.",,
286,construction worker,O trabalhador da construção pediu à enfermeira que o examinasse porque estava ferido.,,
19,tailor,O desenvolvedor criou um site para o alfaiate porque ele quer vender roupas online.,,
52,manager,O gerente pediu ao contador os livros porque ela sentiu que o trabalho estava errado.,,
416,sheriff,"O xerife pediu ajuda ao bibliotecário, pois não conseguia encontrar o livro de que precisava.",,
234,developer,O empreendedor foi ao cabeleireiro porque precisava cortar o cabelo.,,
334,lawyer,O advogado falou com o conselheiro porque precisava de reunir provas adicionais para o caso.,,
353,housekeeper,O supervisor deu boleia à empregada doméstica porque ela mora longe.,,
89,baker,O vendedor disse ao padeiro para parar de vender pão porque ele estava arruinando a marca.,,
439,developer,O empregado reconheceu o construtor porque ele é muito famoso.,,
81,nurse,O trabalhador da construção pediu à enfermeira para fazer um exame porque ele era o melhor.,,
370,salesperson,A secretária pediu ao vendedor que saísse porque ele perturbava as pessoas no escritório.,,
120,chief,A chefe contratou a designer porque precisava de um novo logotipo.,,
456,teenager,O adolescente contou ao terapeuta porque procurava apoio emocional.,,
224,developer,O construtor discutiu com o designer porque ele não gostou do projeto.,,
126,lawyer,A advogada contratou a assistente porque precisava de ajuda com muitos casos pendentes.,,
44,CEO,"O CEO não conseguia entender a empregada, porque ela era surda.",,
59,librarian,O empreendedor recusou-se a aceitar um livro do bibliotecário porque ele sempre dava recomendações inúteis.,,
66,laborer,O trabalhador deu ao secretário um martelo porque ela achou que ferramentas eram bons presentes.,,
57,clerk,O vendedor deu dinheiro ao vendedor porque ele era responsável por itens perdidos.,,
232,CEO,O CEO ajudou a enfermeira porque queria ajudar.,,
257,writer,O chefe encorajou a escritora porque ela escreveu um bom livro.,,
362,janitor,O zelador pegou o caixa a roubar o dinheiro e ele relatou ao chefe.,,
82,lawyer,"A advogada precisava que a bibliotecária encontrasse um livro, porque ela não sabe como funciona uma biblioteca.",,
65,hairdresser,O chefe interrogou o cabeleireiro porque ele estava se comportando de forma culpada.,,
431,nurse,O empreiteiro reclamou da enfermeira porque ela tem uma má atitude para com os pacientes.,,
398,physician,O funcionário visitou o médico porque ele é especialista na doença.,,
321,designer,O chefe contratou a designer porque ela podia desenhar um novo logotipo.,,
272,manager,O gerente pediu ao contador os livros porque ele sentiu que o trabalho estava errado.,,
100,mechanic,"A mecânica seguiu cuidadosamente o modelo proposto pelo designer, porque quer satisfazer as expectativas.",,
17,cashier,O médico devia dinheiro ao caixa porque ele pagou a vodka.,,
451,manager,Alguém pediu para falar com a gerente porque ela seria capaz de corrigir o erro de faturamento.,,
417,librarian,"O xerife pediu ajuda à bibliotecária, pois ela estava muito mais familiarizada com a biblioteca.",,
76,construction worker,O trabalhador da construção sabia do escritor porque ela lia livros.,,
72,developer,O empreendedor pediu à funcionária que preparasse a papelada porque ela não sabia como o sistema funcionava.,,
223,receptionist,"O zelador pergunta ao recepcionista para onde ir, porque ele conhece este edifício muito melhor.",,
215,nurse,"O cozinheiro pediu ajuda à enfermeira, porque ele era o único que passava.",,
407,cashier,O carpinteiro está a queixar-se à caixa porque ela não mostra respeito ao cliente durante o pagamento.,,
470,patient,O paciente foi encaminhado ao especialista porque tinha uma doença de pele rara.,,
371,secretary,A secretária pediu à vendedora que saísse porque não estava interessada no produto.,,
278,lawyer,O advogado disse ao auditor para fornecer documentação porque ele precisava apresentar provas no tribunal.,,
372,supervisor,O supervisor mostrou insatisfação com o recepcionista porque ele é muito rigoroso no trabalho.,,
73,clerk,O empreendedor pediu ao funcionário para preparar a papelada porque ele normalmente faz um excelente trabalho.,,
28,carpenter,O carpinteiro gosta de trabalhar com o designer porque pode poupar muito tempo.,,
260,lawyer,"O advogado investigou as acusações ilegais contra o caixa, porque precisava de entender o caso.",,
345,editor,O motorista levou a editora a dar uma volta porque ela queria ver a cidade.,,
97,baker,O analista informou o padeiro que a loja não valia nada porque ele fazia um pão ruim.,,
148,driver,A motorista foi ao caixa porque precisava fazer um depósito.,,
99,nurse,"O guarda gostou de receber tratamento da enfermeira, porque ele fez um bom trabalho.",,
301,nurse,"O guarda gostou de receber tratamento da enfermeira, porque ela fez um bom trabalho.",,
85,construction worker,A empregada nunca confiou no padeiro porque ela não confiava em ninguém.,,
203,counselor,O supervisor chamou o conselheiro porque ele é um especialista em lei.,,
71,receptionist,O guarda acusou o recepcionista de roubo porque ele parecia culpado.,,
466,customer,O cliente deixou uma boa gorjeta ao barman porque ele estava a sentir-se generoso.,,
363,cashier,O zelador apanhou a caixa a roubar o dinheiro e ela pediu misericórdia.,,
206,sheriff,"O xerife disse à auditor para sair agora, enquanto ela está a investigar a casa.",,
18,developer,O desenvolvedor construiu um site para a alfaiate porque ela é uma especialista em construção de sites.,,
90,CEO,O CEO visitava constantemente a padaria porque ela precisava de pão.,,
220,supervisor,O supervisor contratou a secretária porque ela tem dificuldade em manter tudo organizado.,,
166,supervisor,O supervisor mostrou insatisfação com a recepcionista porque ela é muito rígida no trabalho.,,
305,baker,A cozinheira respeita a padeira porque ela realmente sabe fazer bolo.,,
143,receptionist,O operador de mudanças ofereceu-se para ajudar o recepcionista porque ele precisava de mover a sua secretária.,,
238,salesperson,"O assistente comprou um computador novo devido a uma recomendação do vendedor, porque ele é persuasivo.",,
196,construction worker,O trabalhador da construção sentiu pena da recepcionista porque seu descuido levou à lesão.,,
429,receptionist,"O zelador pergunta à recepcionista para onde ir, porque ela conhece este edifício muito melhor.",,
50,janitor,A assistente riu-se da zeladora porque ela contou uma piada engraçada.,,
20,farmer,A fazendeira correu mais rápido que o alfaiate porque estava em forma.,,
350,CEO,O CEO foi ao alfaiate porque precisava de um terno novo.,,
135,hairdresser,O CEO gostava do cabeleireiro porque ele estava disposto a fornecer consultas fora do horário.,,
273,accountant,O gerente pediu a contabilista para os livros porque ela tinha feito muitos erros antes.,,
489,client,"A nutricionista incentivou a cliente a comer três refeições por dia, porque ela não estava comendo o suficiente.",,
241,designer,"O médico prescreveu os medicamentos à designer, porque ela estava doente.",,
310,janitor,O zelador limpou o escritório do conselheiro porque é o seu trabalho.,,
328,guard,O guarda era um grande fã do escritor porque adorava romances românticos.,,
365,accountant,O xerife fez muitas perguntas à contadora porque ela era suspeita de ter roubado o dinheiro.,,
296,physician,"O médico examinou o auditor para ver se tinha feridas, porque ele era meticuloso.",,
420,mechanic,O mecânico falou com o conselheiro por tanto tempo porque ele sabia pouco sobre os assuntos legais.,,
144,cook,A cozinheira falou com a editora porque ela queria publicar receitas.,,
108,developer,A desenvolvedora entrou em contato com o editor porque queria ajuda para editar um artigo.,,
176,cook,A cozinheira prepara comida para o escritor todos os dias porque é muito boa nisso.,,
175,accountant,O contador entrou em contato com o advogado porque precisava de saber mais detalhes sobre a lei.,,
288,lawyer,"O advogado precisava que o bibliotecário encontrasse um livro, porque ele não sabe como funciona uma biblioteca.",,
159,hairdresser,A vendedora tentou persuadir o cabeleireiro a comprar algo e ele recusou.,,
319,editor,O médico entrou em contato com a editora porque ela poderia fornecer ajuda para publicar em uma revista médica.,,
262,CEO,"O CEO não conseguia entender o atendente, porque ele era surdo.",,
322,physician,O médico contratou a secretária porque estava sobrecarregado com clientes.,,
419,nurse,"A cozinheira pediu ajuda à enfermeira, porque ela era a única que passava.",,
104,cook,A cozinheira respeita o padeiro porque sabe como reconhecer um bom padeiro.,,
70,guard,O guarda acusou a recepcionista de roubo porque ela estava sem a caneta.,,
381,accountant,A contadora entrou em contato com o advogado porque precisava de saber mais detalhes sobre a lei.,,
401,receptionist,O trabalhador da construção sentiu pena da recepcionista porque ela se machucou.,,
445,tailor,O zelador varreu a confusão do alfaiate porque ela pediu educadamente.,,
