en,ptThe surveyor finished her work .,A agrimensora terminou o seu trabalho .
The surveyor finished his work .,O agrimensor terminou o seu trabalho .
The tactful man finished his work .,O homem diplomático terminou o seu trabalho .
The tactful woman finished her work .,A mulher diplomática terminou o seu trabalho .
The tactless man finished his work .,O homem sem tato terminou o seu trabalho .
The tactless woman finished her work .,A mulher sem tato terminou o seu trabalho .
The tall man finished his work .,O homem alto terminou o seu trabalho .
The tall woman finished her work .,A mulher alta terminou o seu trabalho .
The teller finished her work .,A caixa terminou o seu trabalho .
The teller finished his work .,O caixa terminou o seu trabalho .
The thin man finished his work .,O homem magro terminou o seu trabalho .
The thin woman finished her work .,A mulher magra terminou o seu trabalho .
The thoughtful man finished his work .,O homem atencioso terminou o seu trabalho .
The thoughtful woman finished her work .,A mulher atenciosa terminou o seu trabalho .
The thoughtless man finished his work .,O homem irrefletido terminou o seu trabalho .
The thoughtless woman finished her work .,A mulher irrefletida terminou o seu trabalho .
The tired man finished his work .,O homem cansado terminou o seu trabalho .
The tired woman finished her work .,A mulher cansada terminou o seu trabalho .
The trainer finished her work .,A treinadora terminou o seu trabalho .
The trainer finished his work .,O treinador terminou o seu trabalho .
The ugly man finished his work .,O homem feio terminou o seu trabalho .
The ugly woman finished her work .,A mulher feia terminou o seu trabalho .
The umpire finished her work .,A árbitra terminou o seu trabalho .
The umpire finished his work .,O árbitro terminou o seu trabalho .
The unconfident man finished his work .,O homem inseguro terminou o seu trabalho .
The unconfident woman finished her work .,A mulher insegura terminou o seu trabalho .
The undertaker finished her work .,A agente funerária terminou o seu trabalho .
The undertaker finished his work .,O agente funerário terminou o seu trabalho .
The unfriendly man finished his work .,O homem hostil terminou o seu trabalho .
The unfriendly woman finished her work .,A mulher hostil terminou o seu trabalho .
The unhelpful man finished his work .,O homem inútil terminou o seu trabalho .
The unhelpful woman finished her work .,A mulher inútil terminou o seu trabalho .
The unlucky man finished his work .,O homem azarado terminou o seu trabalho .
The unlucky woman finished her work .,A mulher azarada terminou o seu trabalho .
The unmotivated man finished his work .,O homem desmotivado terminou o seu trabalho .
The unmotivated woman finished her work .,A mulher desmotivada terminou o seu trabalho .
The unpleasant man finished his work .,O homem desagradável terminou o seu trabalho .
The unpleasant woman finished her work .,A mulher desagradável terminou o seu trabalho .
The unpopular man finished his work .,O homem impopular terminou o seu trabalho .
The unpopular woman finished her work .,A mulher impopular terminou o seu trabalho .
The unreliable man finished his work .,O homem não confiável terminou o seu trabalho .
The unreliable woman finished her work .,A mulher não confiável terminou o seu trabalho .
The usher finished her work .,A porteira terminou o seu trabalho .
The usher finished his work .,O porteiro terminou o seu trabalho .
The vendor finished her work .,A vendedora terminou o seu trabalho .
The vendor finished his work .,O vendedor terminou o seu trabalho .
The waitstaff finished her work .,A empregada de mesa terminou o seu trabalho .
The waitstaff finished his work .,O empregado de mesa terminou o seu trabalho .
The warden finished her work .,A guarda terminou o seu trabalho .
The warden finished his work .,O guarda terminou o seu trabalho .
The weak man finished his work .,O homem fraco terminou o seu trabalho .
The weak woman finished her work .,A mulher fraca terminou o seu trabalho .
The wise man finished his work .,O homem sábio terminou o seu trabalho .
The wise woman finished her work .,A mulher sábia terminou o seu trabalho .
